name,title,market_value,reply_count,link,ca_address
WIZARDS OF DOGE,DOGE Activist Wizards Taunt Protestors in Washington DC,619.5K,336,https://pump.fun/coin/8kgMCX7ezivU472eXaiGRu8xzNetpdxKDvNQBwKRipxi,8kgMCX7ezivU472eXaiGRu8xzNetpdxKDvNQBwKRipxi
flow,Oscar Winning Director Posts 'Spinning Cat' Meme Version of Flow,1.3M,358,https://pump.fun/coin/HkH7mJK8vYHbbr1mFwiUA94rmKDE8Q5NvQQyxQNnpump,HkH7mJK8vYHbbr1mFwiUA94rmKDE8Q5NvQQyxQNnpump
Dog Picasso,Viral Dog Artist Works His Bags Harder Than You,1.3M,210,https://pump.fun/coin/7ZRgHFqwdzvqhfmg19rSQBD6CZe5iEDkuZoaNUhpump,7ZRgHFqwdzvqhfmg19rSQBD6CZe5iEDkuZoaNUhpump
EVERYTHING IS COMPUTER (EIC),EVERYTHING IS COMPUTER (EIC),1.5M,645,https://pump.fun/coin/9m3nh7YDoF1WSYpNxCjKVU8D1MrXsWRic4HqRaTdcTYB,9m3nh7YDoF1WSYpNxCjKVU8D1MrXsWRic4HqRaTdcTYB
PWEASE,Pwease Rallies Higher as Trenches Begin to Believe in Something,36.4M,4052,https://pump.fun/coin/CniPCE4b3s8gSUPhUiyMjXnytrEqUrMfSsnbBjLCpump,CniPCE4b3s8gSUPhUiyMjXnytrEqUrMfSsnbBjLCpump
FAT NIGGA SEASON,The Trenches Dub March as Fat Boy Season,4.7M,1359,https://pump.fun/coin/5LJMJyR8MtAkbtpf8kFUV7S9oFG3xaGDdcnFxYt9pump,5LJMJyR8MtAkbtpf8kFUV7S9oFG3xaGDdcnFxYt9pump
